RL.NO.SRC,Rule of Law: Number of Sources,"Rule of Law captures perceptions of the extent to which agents have confidence in and abide by the rules of society, and in particular the quality of contract enforcement, property rights, the police, and the courts, as well as the likelihood of crime and violence. Number of sources indicates the number of underlying data sources on which the aggregate estimate is based.","Detailed documentation of the WGI, interactive tools for exploring the data, and full access to the underlying source data available at www.govindicators.org.The WGI are produced by Daniel Kaufmann (Natural Resource Governance Institute and Brookings Institution) and Aart Kraay (World Bank Development Research Group).  Please cite Kaufmann, Daniel, Aart Kraay and Massimo Mastruzzi (2010).  "The Worldwide Governance Indicators:  Methodology and Analytical Issues".  World Bank Policy Research Working Paper No. 5430 (http://papers.ssrn.com/sol3/papers.cfm?abstract_id=1682130).  The WGI do not reflect the official views of the Natural Resource Governance Institute, the Brookings Institution, the World Bank, its Executive Directors, or the countries they represent.",Annual
RL.PER.RNK,Rule of Law: Percentile Rank,"Rule of Law captures perceptions of the extent to which agents have confidence in and abide by the rules of society, and in particular the quality of contract enforcement, property rights, the police, and the courts, as well as the likelihood of crime and violence. Percentile rank indicates the country's rank among all countries covered by the aggregate indicator, with 0 corresponding to lowest rank, and 100 to highest rank.  Percentile ranks have been adjusted to correct for changes over time in the composition of the countries covered by the WGI.","Detailed documentation of the WGI, interactive tools for exploring the data, and full access to the underlying source data available at www.govindicators.org.The WGI are produced by Daniel Kaufmann (Natural Resource Governance Institute and Brookings Institution) and Aart Kraay (World Bank Development Research Group).  Please cite Kaufmann, Daniel, Aart Kraay and Massimo Mastruzzi (2010).  "The Worldwide Governance Indicators:  Methodology and Analytical Issues".  World Bank Policy Research Working Paper No. 5430 (http://papers.ssrn.com/sol3/papers.cfm?abstract_id=1682130).  The WGI do not reflect the official views of the Natural Resource Governance Institute, the Brookings Institution, the World Bank, its Executive Directors, or the countries they represent.",Annual
RL.PER.RNK.LOWER,"Rule of Law: Percentile Rank, Lower Bound of 90% Confidence Interval","Rule of Law captures perceptions of the extent to which agents have confidence in and abide by the rules of society, and in particular the quality of contract enforcement, property rights, the police, and the courts, as well as the likelihood of crime and violence. Percentile rank indicates the country's rank among all countries covered by the aggregate indicator, with 0 corresponding to lowest rank, and 100 to highest rank.  Percentile ranks have been adjusted to correct for changes over time in the composition of the countries covered by the WGI.  Percentile Rank Lower refers to lower bound of 90 percent confidence interval for governance, expressed in percentile rank terms.","Detailed documentation of the WGI, interactive tools for exploring the data, and full access to the underlying source data available at www.govindicators.org.The WGI are produced by Daniel Kaufmann (Natural Resource Governance Institute and Brookings Institution) and Aart Kraay (World Bank Development Research Group).  Please cite Kaufmann, Daniel, Aart Kraay and Massimo Mastruzzi (2010).  "The Worldwide Governance Indicators:  Methodology and Analytical Issues".  World Bank Policy Research Working Paper No. 5430 (http://papers.ssrn.com/sol3/papers.cfm?abstract_id=1682130).  The WGI do not reflect the official views of the Natural Resource Governance Institute, the Brookings Institution, the World Bank, its Executive Directors, or the countries they represent.",Annual
RL.PER.RNK.UPPER,"Rule of Law: Percentile Rank, Upper Bound of 90% Confidence Interval","Rule of Law captures perceptions of the extent to which agents have confidence in and abide by the rules of society, and in particular the quality of contract enforcement, property rights, the police, and the courts, as well as the likelihood of crime and violence. Percentile rank indicates the country's rank among all countries covered by the aggregate indicator, with 0 corresponding to lowest rank, and 100 to highest rank.  Percentile ranks have been adjusted to correct for changes over time in the composition of the countries covered by the WGI.    Percentile Rank Upper refers to upper bound of 90 percent confidence interval for governance, expressed in percentile rank terms.","Detailed documentation of the WGI, interactive tools for exploring the data, and full access to the underlying source data available at www.govindicators.org.The WGI are produced by Daniel Kaufmann (Natural Resource Governance Institute and Brookings Institution) and Aart Kraay (World Bank Development Research Group).  Please cite Kaufmann, Daniel, Aart Kraay and Massimo Mastruzzi (2010).  "The Worldwide Governance Indicators:  Methodology and Analytical Issues".  World Bank Policy Research Working Paper No. 5430 (http://papers.ssrn.com/sol3/papers.cfm?abstract_id=1682130).  The WGI do not reflect the official views of the Natural Resource Governance Institute, the Brookings Institution, the World Bank, its Executive Directors, or the countries they represent.",Annual
RL.STD.ERR,Rule of Law: Standard Error,"Rule of Law captures perceptions of the extent to which agents have confidence in and abide by the rules of society, and in particular the quality of contract enforcement, property rights, the police, and the courts, as well as the likelihood of crime and violence. Standard error indicates the precision of the estimate of governance.  Larger values of the standard error indicate less precise estimates.  A 90 percent confidence interval for the governance estimate is given by the estimate +/- 1.64 times the standard error.","Detailed documentation of the WGI, interactive tools for exploring the data, and full access to the underlying source data available at www.govindicators.org.The WGI are produced by Daniel Kaufmann (Natural Resource Governance Institute and Brookings Institution) and Aart Kraay (World Bank Development Research Group).  Please cite Kaufmann, Daniel, Aart Kraay and Massimo Mastruzzi (2010).  "The Worldwide Governance Indicators:  Methodology and Analytical Issues".  World Bank Policy Research Working Paper No. 5430 (http://papers.ssrn.com/sol3/papers.cfm?abstract_id=1682130).  The WGI do not reflect the official views of the Natural Resource Governance Institute, the Brookings Institution, the World Bank, its Executive Directors, or the countries they represent.",Annual
VA.EST,Voice and Accountability: Estimate,"Voice and Accountability captures perceptions of the extent to which a country's citizens are able to participate in selecting their government, as well as freedom of expression, freedom of association, and a free media. Estimate gives the country's score on the aggregate indicator, in units of a standard normal distribution, i.e. ranging from approximately -2.5 to 2.5.","Detailed documentation of the WGI, interactive tools for exploring the data, and full access to the underlying source data available at www.govindicators.org.The WGI are produced by Daniel Kaufmann (Natural Resource Governance Institute and Brookings Institution) and Aart Kraay (World Bank Development Research Group).  Please cite Kaufmann, Daniel, Aart Kraay and Massimo Mastruzzi (2010).  "The Worldwide Governance Indicators:  Methodology and Analytical Issues".  World Bank Policy Research Working Paper No. 5430 (http://papers.ssrn.com/sol3/papers.cfm?abstract_id=1682130).  The WGI do not reflect the official views of the Natural Resource Governance Institute, the Brookings Institution, the World Bank, its Executive Directors, or the countries they represent.",Annual
VA.NO.SRC,Voice and Accountability: Number of Sources,"Voice and Accountability captures perceptions of the extent to which a country's citizens are able to participate in selecting their government, as well as freedom of expression, freedom of association, and a free media.  Number of sources indicates the number of underlying data sources on which the aggregate estimate is based.","Detailed documentation of the WGI, interactive tools for exploring the data, and full access to the underlying source data available at www.govindicators.org.The WGI are produced by Daniel Kaufmann (Natural Resource Governance Institute and Brookings Institution) and Aart Kraay (World Bank Development Research Group).  Please cite Kaufmann, Daniel, Aart Kraay and Massimo Mastruzzi (2010).  "The Worldwide Governance Indicators:  Methodology and Analytical Issues".  World Bank Policy Research Working Paper No. 5430 (http://papers.ssrn.com/sol3/papers.cfm?abstract_id=1682130).  The WGI do not reflect the official views of the Natural Resource Governance Institute, the Brookings Institution, the World Bank, its Executive Directors, or the countries they represent.",Annual
VA.PER.RNK,Voice and Accountability: Percentile Rank,"Voice and Accountability captures perceptions of the extent to which a country's citizens are able to participate in selecting their government, as well as freedom of expression, freedom of association, and a free media. Percentile rank indicates the country's rank among all countries covered by the aggregate indicator, with 0 corresponding to lowest rank, and 100 to highest rank.  Percentile ranks have been adjusted to correct for changes over time in the composition of the countries covered by the WGI.","Detailed documentation of the WGI, interactive tools for exploring the data, and full access to the underlying source data available at www.govindicators.org.The WGI are produced by Daniel Kaufmann (Natural Resource Governance Institute and Brookings Institution) and Aart Kraay (World Bank Development Research Group).  Please cite Kaufmann, Daniel, Aart Kraay and Massimo Mastruzzi (2010).  "The Worldwide Governance Indicators:  Methodology and Analytical Issues".  World Bank Policy Research Working Paper No. 5430 (http://papers.ssrn.com/sol3/papers.cfm?abstract_id=1682130).  The WGI do not reflect the official views of the Natural Resource Governance Institute, the Brookings Institution, the World Bank, its Executive Directors, or the countries they represent.",Annual
VA.PER.RNK.LOWER,"Voice and Accountability: Percentile Rank, Lower Bound of 90% Confidence Interval","Voice and Accountability captures perceptions of the extent to which a country's citizens are able to participate in selecting their government, as well as freedom of expression, freedom of association, and a free media. Percentile rank indicates the country's rank among all countries covered by the aggregate indicator, with 0 corresponding to lowest rank, and 100 to highest rank.  Percentile ranks have been adjusted to correct for changes over time in the composition of the countries covered by the WGI. Percentile Rank Lower refers to lower bound of 90 percent confidence interval for governance, expressed in percentile rank terms.","Detailed documentation of the WGI, interactive tools for exploring the data, and full access to the underlying source data available at www.govindicators.org.The WGI are produced by Daniel Kaufmann (Natural Resource Governance Institute and Brookings Institution) and Aart Kraay (World Bank Development Research Group).  Please cite Kaufmann, Daniel, Aart Kraay and Massimo Mastruzzi (2010).  "The Worldwide Governance Indicators:  Methodology and Analytical Issues".  World Bank Policy Research Working Paper No. 5430 (http://papers.ssrn.com/sol3/papers.cfm?abstract_id=1682130).  The WGI do not reflect the official views of the Natural Resource Governance Institute, the Brookings Institution, the World Bank, its Executive Directors, or the countries they represent.",Annual
VA.PER.RNK.UPPER,"Voice and Accountability: Percentile Rank, Upper Bound of 90% Confidence Interval","Voice and Accountability captures perceptions of the extent to which a country's citizens are able to participate in selecting their government, as well as freedom of expression, freedom of association, and a free media. Percentile rank indicates the country's rank among all countries covered by the aggregate indicator, with 0 corresponding to lowest rank, and 100 to highest rank.  Percentile ranks have been adjusted to correct for changes over time in the composition of the countries covered by the WGI.  Percentile Rank Upper refers to upper bound of 90 percent confidence interval for governance, expressed in percentile rank terms.","Detailed documentation of the WGI, interactive tools for exploring the data, and full access to the underlying source data available at www.govindicators.org.The WGI are produced by Daniel Kaufmann (Natural Resource Governance Institute and Brookings Institution) and Aart Kraay (World Bank Development Research Group).  Please cite Kaufmann, Daniel, Aart Kraay and Massimo Mastruzzi (2010).  "The Worldwide Governance Indicators:  Methodology and Analytical Issues".  World Bank Policy Research Working Paper No. 5430 (http://papers.ssrn.com/sol3/papers.cfm?abstract_id=1682130).  The WGI do not reflect the official views of the Natural Resource Governance Institute, the Brookings Institution, the World Bank, its Executive Directors, or the countries they represent.",Annual
VA.STD.ERR,Voice and Accountability: Standard Error,"Voice and Accountability captures perceptions of the extent to which a country's citizens are able to participate in selecting their government, as well as freedom of expression, freedom of association, and a free media. Standard error indicates the precision of the estimate of governance.  Larger values of the standard error indicate less precise estimates.  A 90 percent confidence interval for the governance estimate is given by the estimate +/- 1.64 times the standard error.",,
